{
  "schema": "qore-run/1",
  "id": "qualification-verifier-20261016-071817",
  "method": "review",
  "skill": "qore-review-qaizen-labs",
  "candidate_sha256": "2b4d8c75c24c9377aa41c27c7a317901043ea76216ec6d595ed198059d1502c1",
  "target": {
    "label": "public scoped coordination files and public verification criteria",
    "snapshot_sha256": "3282ea44daa3be81eeadd6185274bd53d29cb43a07e14fd801ee14b33c79baac"
  },
  "last_relevant_change": "2026-10-16T07:10:43.354355+00:00",
  "environment": {
    "id": "qualification-local",
    "operator": "agent fresh independent verifier",
    "host": "0da4f65011ce"
  },
  "profile": {
    "id": "qaizen-labs",
    "version": "0.1.0",
    "sha256": "f76afdd45cb6352e5044a06affc4182ea6cd40aa9c012fb216636a61faa428f0"
  },
  "required_phases": [
    "profile_preflight",
    "verifier",
    "findings_validation",
    "finder.correctness",
    "finder.security",
    "finder.feasibility",
    "redaction"
  ],
  "phases": [
    {
      "id": "profile_preflight",
      "actor_id": "fresh-independent-verifier-root",
      "status": "PASS",
      "artifacts": [
        "profile_preflight-execution.json"
      ]
    },
    {
      "id": "verifier",
      "actor_id": "fresh-independent-verifier-root",
      "status": "PASS",
      "artifacts": [
        "verifier-execution.json"
      ]
    },
    {
      "id": "findings_validation",
      "actor_id": "fresh-independent-verifier-root",
      "status": "PASS",
      "artifacts": [
        "findings_validation-execution.json"
      ]
    },
    {
      "id": "finder.correctness",
      "actor_id": "upstream-uninspected-finder.correctness",
      "status": "SKIPPED",
      "artifacts": [],
      "reason": "Verifier-only invocation; upstream context/artifacts forbidden and not audited. Actor string is an unavailable-role placeholder, not evidence of a returned context."
    },
    {
      "id": "finder.security",
      "actor_id": "upstream-uninspected-finder.security",
      "status": "SKIPPED",
      "artifacts": [],
      "reason": "Verifier-only invocation; upstream context/artifacts forbidden and not audited. Actor string is an unavailable-role placeholder, not evidence of a returned context."
    },
    {
      "id": "finder.feasibility",
      "actor_id": "upstream-uninspected-finder.feasibility",
      "status": "SKIPPED",
      "artifacts": [],
      "reason": "Verifier-only invocation; upstream context/artifacts forbidden and not audited. Actor string is an unavailable-role placeholder, not evidence of a returned context."
    },
    {
      "id": "redaction",
      "actor_id": "upstream-uninspected-redaction",
      "status": "SKIPPED",
      "artifacts": [],
      "reason": "Verifier-only invocation; upstream context/artifacts forbidden and not audited. Actor string is an unavailable-role placeholder, not evidence of a returned context."
    }
  ],
  "artifacts": [
    {
      "path": "REPORT.md",
      "sha256": "aaea07b93ead4df30cbc0e48bcba406664076de98d46e5eca971053ed9a66e34",
      "kind": "presentation"
    },
    {
      "path": "commands.json",
      "sha256": "39438b4ab722e972e51309be8ad4a080885c6a0320f4da4125c24e4646a78c48",
      "kind": "presentation"
    },
    {
      "path": "contract-result.json",
      "sha256": "7f557ba27626c65e7eb10c7b17773f82e9feae273715b633b694723f87b3c1ee",
      "kind": "presentation"
    },
    {
      "path": "finding-lint.json",
      "sha256": "4c07cdce9516448914a19bc797ac3e46e2e25953ce87c207163e0283358647a3",
      "kind": "presentation"
    },
    {
      "path": "findings_validation-execution.json",
      "sha256": "ed08aa63b73b5f7f7999241be41e2672feec0da837061bad23bfd1babfbc257f",
      "kind": "execution",
      "candidate_sha256": "2b4d8c75c24c9377aa41c27c7a317901043ea76216ec6d595ed198059d1502c1",
      "target_snapshot_sha256": "3282ea44daa3be81eeadd6185274bd53d29cb43a07e14fd801ee14b33c79baac",
      "observed_at": "2026-10-16T07:20:42.755172+00:00"
    },
    {
      "path": "identity.json",
      "sha256": "548ac2a0fd8b77ba84ea0ebfc1a1796184169db1ef125e1cac64369e7e6bf628",
      "kind": "presentation"
    },
    {
      "path": "preflight.json",
      "sha256": "cc7c5c9ff4ed6dddfc86cdcfc44b5930a36f6f95e867dda4cad79007945ee645",
      "kind": "presentation"
    },
    {
      "path": "profile-use.json",
      "sha256": "3aab4adf4fa67cf239c87ad4904c3da89f553b065a6fe2ee5e7d79152d57e95a",
      "kind": "presentation"
    },
    {
      "path": "profile_preflight-execution.json",
      "sha256": "7e51f0f0e2abee6cf822690df3a327344b85936b6882968c3850da70fa775428",
      "kind": "execution",
      "candidate_sha256": "2b4d8c75c24c9377aa41c27c7a317901043ea76216ec6d595ed198059d1502c1",
      "target_snapshot_sha256": "3282ea44daa3be81eeadd6185274bd53d29cb43a07e14fd801ee14b33c79baac",
      "observed_at": "2026-10-16T07:20:42.754132+00:00"
    },
    {
      "path": "reproduce.py",
      "sha256": "997e0894c68a10ffb1b5691a07cbeef3a7773039b4151cf3de068ce15c63bd60",
      "kind": "source"
    },
    {
      "path": "reproduction-results.json",
      "sha256": "0ec59f8111b08102203716f1eae5de28e6a3c3f21fccb6cd16e332eb98b93f1b",
      "kind": "presentation"
    },
    {
      "path": "save_execution.py",
      "sha256": "9d35c0cf9a727a7294533258ccc514afa7f4787f95ba09e7590c3f85205897b6",
      "kind": "source"
    },
    {
      "path": "save_packet.py",
      "sha256": "b914c7de97b868b7d13d2af49a47c069a1479a3979f699f441cb8bfd83917195",
      "kind": "source"
    },
    {
      "path": "skill-manifest.json",
      "sha256": "2b4d8c75c24c9377aa41c27c7a317901043ea76216ec6d595ed198059d1502c1",
      "kind": "source"
    },
    {
      "path": "target-manifest.json",
      "sha256": "3282ea44daa3be81eeadd6185274bd53d29cb43a07e14fd801ee14b33c79baac",
      "kind": "source"
    },
    {
      "path": "tests-agent-mail.txt",
      "sha256": "4a160235c0add54f7a5997815d0e01a072210439de4899c702c94dd3cd814662",
      "kind": "presentation"
    },
    {
      "path": "tests-coordination.txt",
      "sha256": "670a39115e7523a8984e4842e16547cb2094b03fad392b037b4b9dc8b2656e62",
      "kind": "presentation"
    },
    {
      "path": "tests-task-gate.txt",
      "sha256": "98ea402db7b97462d0214b82d1b2df836ec5990adfeb73bb24606244b7c7ad77",
      "kind": "presentation"
    },
    {
      "path": "verified.json",
      "sha256": "e9cb1a1fffe0622542bf81656c6c63263e64721bd56f0b47373f8d8e817dad26",
      "kind": "presentation"
    },
    {
      "path": "verifier-execution.json",
      "sha256": "8e8113c1e37b9cb06b7fcbdde90f620768755624b0633d8b3de5142ad3124f0b",
      "kind": "execution",
      "candidate_sha256": "2b4d8c75c24c9377aa41c27c7a317901043ea76216ec6d595ed198059d1502c1",
      "target_snapshot_sha256": "3282ea44daa3be81eeadd6185274bd53d29cb43a07e14fd801ee14b33c79baac",
      "observed_at": "2026-10-16T07:20:42.754440+00:00"
    }
  ],
  "commands": [
    {
      "argv": [
        "python3",
        ".agents/skills/qore-review-qaizen-labs/scripts/project-check.py",
        ".agents/skills/qore-review-qaizen-labs/references/project.json",
        "--root",
        "/workspace/project/examples/qaizen-labs",
        "--method",
        "review"
      ],
      "cwd": "/workspace/project/examples/qaizen-labs",
      "exit_code": 0,
      "artifact": "preflight.json"
    },
    {
      "argv": [
        "python3",
        "-B",
        "checks/check_contract.py",
        "surface-contract.json"
      ],
      "cwd": "/workspace/project/examples/qaizen-labs",
      "exit_code": 0,
      "artifact": "contract-result.json"
    },
    {
      "argv": [
        "python3",
        "-B",
        "/workspace/qualification/verifier/reproduce.py"
      ],
      "exit_code": 0,
      "artifact": "reproduction-results.json"
    },
    {
      "argv": [
        "python3",
        "-B",
        "-m",
        "unittest",
        "discover",
        "-s",
        "/workspace/project/tests",
        "-p",
        "test_coordination.py"
      ],
      "exit_code": 0,
      "artifact": "tests-coordination.txt"
    },
    {
      "argv": [
        "python3",
        "-B",
        "-m",
        "unittest",
        "discover",
        "-s",
        "/workspace/project/tests",
        "-p",
        "test_agent_mail.py"
      ],
      "exit_code": 0,
      "artifact": "tests-agent-mail.txt"
    },
    {
      "argv": [
        "python3",
        "-B",
        "-m",
        "unittest",
        "discover",
        "-s",
        "/workspace/project/tests",
        "-p",
        "test_task_gate.py"
      ],
      "exit_code": 0,
      "artifact": "tests-task-gate.txt"
    },
    {
      "argv": [
        "python3",
        "-B",
        "/workspace/qualification/verifier/save_packet.py"
      ],
      "exit_code": 0,
      "artifact": "verified.json"
    },
    {
      "argv": [
        "node",
        ".agents/skills/qore-review-qaizen-labs/scripts/finding-lint.mjs",
        "/workspace/qualification/verifier/verified.json",
        "--verifier=ran",
        "--json"
      ],
      "cwd": "/workspace/project/examples/qaizen-labs",
      "exit_code": 0,
      "artifact": "finding-lint.json"
    }
  ],
  "limitations": [
    "Verifier-only execution. Upstream finders/redaction not audited. No source changes. No live services, wire exchange or browser observations. All five claims examined with synthetic local evidence; C01/F-FEAS-01 overlap. No release decision."
  ],
  "coverage": "PARTIAL"
}
